{
  "job_schema": "0.1.0",
  "id": "sample.route-story",
  "template": "social.route-story",
  "template_version": "0.1.0",
  "inputs": {
    "title": "Route 66 in two weeks",
    "stop_1": "Chicago",
    "lat_1": 41.88,
    "lon_1": -87.63,
    "note_1": "Mile zero",
    "stop_2": "St. Louis",
    "lat_2": 38.63,
    "lon_2": -90.2,
    "note_2": "Gateway Arch",
    "stop_3": "Oklahoma City",
    "lat_3": 35.47,
    "lon_3": -97.52,
    "stop_4": "Albuquerque",
    "lat_4": 35.08,
    "lon_4": -106.65,
    "stop_5": "Santa Monica",
    "lat_5": 34.02,
    "lon_5": -118.49,
    "note_5": "End of the trail",
    "distance": 2448,
    "distance_unit": "mi",
    "duration": 14,
    "duration_unit": "days",
    "look": "atlas",
    "energy": "sunny"
  },
  "assets": {},
  "shot_assets": {},
  "approved_gates": []
}
