{
  "job_schema": "0.1.0",
  "id": "sample.code-typing-reel",
  "template": "educational.code-typing-reel",
  "template_version": "0.1.0",
  "inputs": {
    "hook": "Python's walrus operator in 10 seconds",
    "code": "import re\n\nlines = [\"id=42\", \"name=Ada\", \"oops\"]\n\nfor line in lines:\n    if (match := re.match(r\"(\\w+)=(\\w+)\", line)):\n        key, value = match.groups()\n        print(f\"{key} -> {value}\")\n",
    "takeaway": "Assign inside the condition: one lookup, no duplicate call.",
    "file_name": "walrus.py"
  },
  "assets": {},
  "shot_assets": {},
  "approved_gates": []
}
