{
  "job_schema": "0.1.0",
  "id": "sample.title-sting",
  "template": "commercial.title-sting",
  "template_version": "0.2.0",
  "inputs": {
    "name": "VideoGenome",
    "tagline": "Design once. Produce anywhere.",
    "look": "chrome"
  },
  "assets": {},
  "shot_assets": {},
  "approved_gates": []
}
